{
  "schemaVersion": "1.0",
  "id": "rws-original",
  "name": "Rider–Waite–Smith Original",
  "authors": [
    "Arthur Edward Waite",
    "Pamela Colman Smith"
  ],
  "edition": "Pam-A",
  "publicationPeriod": "1909/1910",
  "source": {
    "status": "verified",
    "title": "Rider-Waite-Smith tarot deck (TaionWC)",
    "url": "https://commons.wikimedia.org/wiki/Category:Rider-Waite-Smith_tarot_deck_(TaionWC)",
    "publisher": "Wikimedia Commons",
    "retrievedAt": "2026-07-20"
  },
  "license": {
    "status": "approved",
    "name": "Public Domain Mark 1.0",
    "url": "https://creativecommons.org/publicdomain/mark/1.0/",
    "commercialUse": "allowed",
    "modification": "allowed",
    "redistribution": "allowed",
    "attributionRequired": "no",
    "notes": "Commons API 审计确认78个文件均标记 Public domain、CC-PD-Mark 和 PD-old-80-expired。项目方于2026-07-20接受 Wikimedia 不提供权利状态保证的免责声明，并批准 TaionWC Pam-A 集合作为首套正式牌面来源。建议持续保留 Pamela Colman Smith、Pam-A、Wikimedia Commons 和逐文件来源信息。"
  },
  "sourceBatchId": "commons-taionwc-185b38b7d45d4865ac4fd5f0d3420fa8dfbfa93556633841d11681694cc6acdc",
  "version": "1.0.0",
  "assetBuild": {
    "format": "webp",
    "maxWidth": 720,
    "quality": 78,
    "fit": "inside",
    "withoutEnlargement": true
  }
}
